,title,description,content,author,publishedAt,source,url,urlToImage
498,The Role Of Humans And AI In Social Media's Battle Against Misinformation,"With artificial intelligence increasingly helping to proliferate false claims, wide access to accurate information is more difficult.","Jonathan Freger is cofounder and CTO of WebPurify, leading content moderation service.
getty
Information is our most valuable social currency and those who have the ability to control it hold great… [+6092 chars]","Jonathan Freger, Forbes Councils Member, 
 Jonathan Freger, Forbes Councils Member
 https://www.forbes.com/sites/forbestechcouncil/people/jonathanfreger/",2024-02-12T12:45:00Z,,https://www.forbes.com/sites/forbestechcouncil/2024/02/12/the-role-of-humans-and-ai-in-social-medias-battle-against-misinformation/,https://imageio.forbes.com/specials-images/imageserve/655225b46f7ef811892e44e8/0x0.jpg?format=jpg&height=900&width=1600&fit=bounds
499,"Actress Sara Ramirez, 'Non-Binary' Love Interest in 'Sex and the City' Reboot, Claims Hollywood 'Blacklist' of Pro-Palestinian Talent","Mexican-U.S. actress Sara Ramirez, who plays the ""non-binary"" love interest Che Diaz in the recent Sex and the City woke reboot, has condemned the character she gave life to while slamming the entertainment industry for allegedly making “blacklists” of actors…","Mexican-U.S. actress Sara Ramirez, who plays the “non-binary” love interest Che Diaz in the recent Sex and the City woke reboot, has condemned the character she gave life to while slamming the entert… [+1241 chars]","Simon Kent, Simon Kent",2024-01-19T14:15:08Z,breitbart-news,https://www.breitbart.com/entertainment/2024/01/19/actress-sara-ramirez-non-binary-love-interest-in-sex-and-the-city-reboot-claims-hollywood-blacklist-of-pro-palestinian-talent/,https://media.breitbart.com/media/2024/01/Sara-Ramirez-640x335.jpg
482,Super Bowl Ads Promoting Jesus To Air Again This Year—And This Billionaire Family Is Behind It,Religious advertisements from two different groups will run during the Super Bowl this Sunday.,"A billionaire family behind one of the nation's most successful retail craft store chains will, for the second year in a row, help to run a pair of Super Bowl ads in commercial time worth millions of… [+4247 chars]","Mary Whitfill Roeloffs, Forbes Staff, 
 Mary Whitfill Roeloffs, Forbes Staff
 https://www.forbes.com/sites/maryroeloffs/",2024-02-07T19:07:51Z,,https://www.forbes.com/sites/maryroeloffs/2024/02/07/super-bowl-ads-promoting-jesus-airing-again-year-and-this-billionaire-family-is-behind-it/,"https://imageio.forbes.com/specials-images/imageserve/65c3c6a75dcff27d859695ca/0x0.jpg?format=jpg&crop=3999,2247,x0,y0,safe&height=900&width=1600&fit=bounds"
483,"MMWR Supplement: Overview and Methodology of the National HIV Behavioral Surveillance Among Transgender Women - Seven Urban Areas, United States, 2019-2020",This report describes 2019-2020 data and system methods from the National HIV Behavioral Surveillance Among Transgender Women.,"Overview
NHBS-Trans is an HIV-related biobehavioral surveillance system to monitor behavioral risk factors, prevention use, and HIV prevalence among transgender women. During 2019–2020, CDC conducte… [+10132 chars]",CDC,2024-01-23T18:00:00Z,,https://www.cdc.gov/mmwr/volumes/73/su/su7301a1.htm,https://www.cdc.gov/mmwr/volumes/73/su/social-media/su7301a1_TransgenderSupplement_Overview_IMAGE_25Jan2024_1200x675.jpeg?_=35753
484,Magic Kingdom’s Maternity Ward and Transgender Debate Explained,"In early January, satirical fake news site Mouse Trap News claimed that a maternity ward was heading to Walt Disney World’s Magic Kingdom. The outlet, which promises “real Disney news that is 100% fake,” shared the announcement on January 4, along with a vide…","In early January, satirical fake news site Mouse Trap News claimed that a maternity ward was heading to Walt Disney World’s Magic Kingdom. The outlet, which promises “real Disney news that is 100% fa… [+4350 chars]",Thomas Hitchen,2024-01-15T15:34:40Z,,https://insidethemagic.net/2024/01/magic-kingdom-maternity-ward-transgender-debate-explained-th1/,https://insidethemagic.net/wp-content/uploads/2024/01/cinderella-castle-mickey-mouse-maternity.jpg
485,"10 things you need to know today: January 17, 2024","The US strikes Houthi targets in Yemen a third time, Trump's second sex defamation trial begins, and more","1. US strikes Houthi targets for third time
The U.S. military carried out more strikes Tuesday against Houthi anti-ship ballistic missile sites in Yemen, knocking out several missiles as they were b… [+7825 chars]","theweekonlineeditors@futurenet.com (Harold Maass, The Week US)",2024-01-17T12:25:47Z,,https://theweek.com/digest/round-up/10-things-you-need-to-know-today-january-17-2024,https://cdn.mos.cms.futurecdn.net/iAijjex2cuiENs8EGDgVtV-1200-80.jpg
486,Syndication and the City,"‘Sex and the City’ is heading to Netflix in April 2024, and I couldn’t help but wonder … is this going to start a whole new round of discourse?","Looking at Mirandas hair color, I couldnt help but wonder what would happen if we joined the other big red?
HBOs groundbreaking comedy Sex and the City is coming to Netflix in early April, according… [+1660 chars]",Jason P. Frank,2024-01-24T23:09:24Z,,http://www.vulture.com/article/sex-and-the-city-netflix-hbo-syndication.html,https://pyxis.nymag.com/v1/imgs/022/bdf/58b29e2829f931fbc7f6efbd3b111276e7-GettyImages-51092892.1x.rsocial.w1200.jpg
487,"MMWR Supplement: Prevalence of Discrimination and the Association Between Employment Discrimination and Health Care Access and Use - National HIV Behavioral Surveillance Among Transgender Women, Seven Urban Areas, United States, 2019-2020","This report describes the prevalence of six discrimination types toward transgender women and the association between employment discrimination and sociodemographic characteristics, health care access, and health care use.","Seven in 10 transgender women experienced transphobic discrimination, and one in three reported employment discrimination during the past year. Having trouble getting a job because of being transgend… [+6504 chars]",CDC,2024-01-23T18:00:00Z,,https://www.cdc.gov/mmwr/volumes/73/su/su7301a6.htm,https://www.cdc.gov/mmwr/volumes/73/su/social-media/su7301a6_TransgenderSupplement_IMAGE_25Jan2024_1200x675.jpg?_=07063
488,Appeals court 'puts pressure on Trump’s team' to act fast: legal experts,"Donald Trump lost his ""presidential immunity"" case on Tuesday in which the D.C. Circuit Court of Appeals destroyed his arguments in court. Several legal experts were quick to offer analysis on the decision, which they said puts Trump in a box when it comes to…",The Alabama Republican freshman lawmaker made a name for himself by blocking hundreds of critical military promotions last year over the military's policy of reimbursing service members who are force… [+3269 chars],Sarah K. Burris,2024-02-06T18:16:33Z,,https://www.rawstory.com/trump-crimes-2667180756/,https://www.rawstory.com/media-library/republican-presidential-candidate-and-former-president-donald-trump-speaks-during-a-campaign-rally-at-the-snhu-arena-on-january.jpg?id=51327149&width=1200&height=600&coordinates=0%2C25%2C0%2C25
489,Elizabeth Holmes celebrates 40th birthday with her kids in prison yard,"Even though Elizabeth Holmes is just nine months into a projected nine years in federal prison, she appeared to have a happy 40th birthday on Saturday when her family paid her a visit and she got some playtime in the prison yard with her two young children. T…",The Alabama Republican freshman lawmaker made a name for himself by blocking hundreds of critical military promotions last year over the military's policy of reimbursing service members who are force… [+3269 chars],The Mercury News,2024-02-06T18:14:16Z,,https://www.rawstory.com/elizabeth-holmes-celebrates-40th-birthday-with-her-kids-in-prison-yard/,https://www.rawstory.com/media-library/image.jpg?id=51394368&width=980
490,The US government has lost all legitimacy with its increasingly psychotic behavior,"If I believe myself to be a fork, must society be made to agree? Should I be encouraged to hang out near salad bars with the expectation that diners will trust me with their food? If I continue to get passed over for other silverware, should I be allowed to s…","If I believe myself to be a fork, must society be made to agree? Should I be encouraged to hang out near salad bars with the expectation that diners will trust me with their food? If I continue to ge… [+5038 chars]",News Editors,2024-01-21T06:00:00Z,,https://www.naturalnews.com/2024-01-21-the-us-government-has-lost-all-legitimacy.html,https://www.naturalnews.com/wp-content/uploads/sites/91/2024/01/United-States-Senate-Building-Washington-Government-e1459495437414.jpg
491,Alina Habba keeps low profile as Trump suggests he's shopping for new lawyer,"After Donald Trump suggested she would not represent him in his appeal of the $83.3 million judgment leveled against him in E. Jean Carroll's second civil suit, Alina Habba has virtually disappeared off the radar, Newsweek reported Friday.In a post to Truth S…","Scarlett Jenkinson and Eddie Ratcliffe, both 16, killed Brianna Ghey in Warrington, northwest England, in February last year, in what the judge called a planned ""frenzied and ferocious"" assault.
Ghe… [+3579 chars]",Sky Palma,2024-02-02T16:21:54Z,,https://www.rawstory.com/alina-habba-2667154866/,https://www.rawstory.com/media-library/alina-habba.jpg?id=51070203&width=1200&height=600&coordinates=0%2C71%2C0%2C71
492,Aileen Cannon blows off DOJ concerns about witness safety to give Trump a win,Judge Aileen Cannon gave Donald Trump's defense another win by blowing off concerns by the Department of Justice in the Mar-a-Lago classified documents case.Special counsel Jack Smith's team met last week with the U.S. District Court judge to explain why some…,The Alabama Republican freshman lawmaker made a name for himself by blocking hundreds of critical military promotions last year over the military's policy of reimbursing service members who are force… [+3269 chars],Travis Gettys,2024-02-06T17:35:30Z,,https://www.rawstory.com/aileen-cannon-classified-documents-2667181870/,https://www.rawstory.com/media-library/new-questions-raised-over-how-trump-s-mar-a-lago-case-ended-up-in-the-hands-of-judge-aileen-cannon.jpg?id=31957167&width=1200&height=600&coordinates=0%2C30%2C0%2C31
493,ROOKE: Maine Follows Blueprint To Legalize New Form Of Child Trafficking,Two attorneys concluded that adults could traffic and deliver confused teens to Maine to receive life-altering medical treatments without parental consent.,"After reading through Maine’s new legislation — “An Act to Safeguard Gender-affirming Health Care” — which effectively makes Maine a “sanctuary state” for minors seeking sex change treatment, I had o… [+11809 chars]",Mary Rooke,2024-01-23T22:04:10Z,,https://dailycaller.com/2024/01/23/mary-rooke-maine-act-safeguard-gender-affirming-healthcare-ld1735-sanctuary-state/,https://cdn01.dailycaller.com/wp-content/uploads/2024/01/GettyImages-1246425474-scaled-e1705688389779.jpg
494,West Virginia Bill Would Allow Teachers to Carry Guns at School,"West Virginia’s Republican-dominated Legislature pushed forward a slate of contentious bills Wednesday that would arm teachers, allow people to sue libraries over books that offend them and restrict where transgender kids can use the bathroom at school. Descr…","West Virginia’s Republican-dominated Legislature pushed forward a slate of contentious bills Wednesday that would arm teachers, allow people to sue libraries over books that offend them and restrict … [+6267 chars]",Admin,2024-01-26T13:42:41Z,,https://www.insurancejournal.com/news/southeast/2024/01/26/757355.htm,https://www.insurancejournal.com/app/uploads/2019/06/man-gun-in-classroom-school-shooting.jpg
495,Why Christians Who Love Their Gay And Trans Neighbors Won’t Attend Their Weddings,"If Christians want to convey love, there are other — and truer — ways of doing so than attending a celebration of sin.","Alistair Begg, a 71-year-old evangelical Scottish pastor of Cleveland’s Parkside Church, who has an influential radio ministry called Truth For Life, should repent of the dangerous advice he gave on … [+7475 chars]",Robert Gagnon,2024-01-29T12:45:27Z,,https://thefederalist.com/2024/01/29/why-christians-who-love-their-gay-and-trans-neighbors-wont-attend-their-weddings/,https://thefederalist.com/wp-content/uploads/2024/01/Wedding-Rings-Hands.jpg
496,"MMWR Supplement: Characteristics Associated with Pre-Exposure Prophylaxis Discussion and Use Among Transgender Women Without HIV Infection - National HIV Behavioral Surveillance Among Transgender Women, Seven Urban Areas, United States, 2019-2020",This report examines whether transgender women who report behaviors associated with HIV acquisition were more likely to have had discussions with their clinician about pre-exposure prophylaxis (PrEP) and used PrEP.,"The findings in this report are encouraging. Awareness of PrEP in this sample was high (92.0%) compared with previous studies (6,14–16), which might indicate progress in increasing awareness of PrEP … [+7490 chars]",CDC,2024-01-23T18:00:00Z,,https://www.cdc.gov/mmwr/volumes/73/su/su7301a2.htm,https://www.cdc.gov/mmwr/volumes/73/su/social-media/su7301a2_TransgenderSupplement_IMAGE_25Jan2024_1200x675.jpg?_=07052
497,Kansas Attorney General Demands Schools Out Trans Kids,"Kansas Attorney General Kris Kobach (R) ""is telling public schools they’re required to tell parents their children are transgender or nonbinary even if they’re not out at home, though Kansas is not among the states with a law that explicitly says to do that,""…","“There are a lot of blogs and news sites claiming to understand politics, but only a few actually do. Political Wire is one of them.”
 Chuck Todd, host of “Meet the Press”
“Concise. Relevant. To th… [+594 chars]",Taegan Goddard,2024-02-09T22:21:06Z,,https://politicalwire.com/2024/02/09/kansas-attorney-general-demands-schools-out-trans-kids/,https://politicalwire.com/wp-content/uploads/2018/02/PW-podcast-logo.jpg
498,Missouri GOP Votes To Ban Abortion In Cases Of Rape And Incest,"Missouri state Senate Republicans took time away from their filibustering of one another to vote down two Democratic-led amendments to the state’s draconian abortion laws that would have allowed exceptions for rape and incest on Wednesday. In 2022, the Republ…",Missouri state Senate Republicans took time away from their filibustering of one another to vote down two Democratic-led amendments to the states draconian abortion laws that would have allowed excep… [+3753 chars],Walter Einenkel,2024-02-10T14:38:24Z,,https://crooksandliars.com/2024/02/missouri-gop-votes-ban-abortion-cases-rape,https://crooksandliars.com/files/embeds/2024/02/59098.jpg
499,Oregon GOP Lawmakers Who Walked Out Can’t Run Again,"""The Oregon Supreme Court said Thursday that 10 Republican state senators who staged a record-long walkout last year to stall bills on abortion, transgender health care and gun rights cannot run for re-election,"" the AP reports.""The decision upholds the secre…","“There are a lot of blogs and news sites claiming to understand politics, but only a few actually do. Political Wire is one of them.”
 Chuck Todd, host of “Meet the Press”
“Concise. Relevant. To th… [+594 chars]",Taegan Goddard,2024-02-01T19:53:02Z,,https://politicalwire.com/2024/02/01/oregon-gop-lawmakers-who-walked-out-cant-run-again/,https://politicalwire.com/wp-content/uploads/2018/02/PW-podcast-logo.jpg
37,15 of History’s Greatest Mysteries,"From a book no one can decipher and puzzling disappearances to unsolved crimes and beyond, many of these historical mysteries still have us scratching our heads.","By their very nature, historical mysteries are tough to crack. After all, people have been trying to solve them for decades, if not centuries, and theyve got nothing but reasonable theories (and plen… [+29222 chars]",April Snellings,2024-01-22T17:03:00Z,,https://www.mentalfloss.com/posts/history-greatest-mysteries,"https://images2.minutemediacdn.com/image/upload/c_crop,w_2666,h_1499,x_0,y_0/c_fill,w_1440,ar_16:9,f_auto,q_auto,g_auto/images/voltaxMediaLibrary/mmsport/mentalfloss/01hmhkyn8tp91g78a5w2.jpg"
43,My Comments To Attorney General Rob Bonta Regarding Common Sense Media’s Dangerous ‘Protect The Kids’ Ballot Initiative,Last week I noted that the improperly named Common Sense Media had submitted a very problematic and dangerous California ballot initiative that aims to hold social media companies liable should any harm that happens to any child be loosely connected to social…,"from the this-is-a-bad-idea dept
Last week I noted that the improperly named Common Sense Media had submitted a very problematic and dangerous California ballot initiative that aims to hold social m… [+13065 chars]",Mike Masnick,2024-01-17T20:00:00Z,,https://www.techdirt.com/2024/01/17/my-comments-to-attorney-general-rob-bonta-regarding-common-sense-medias-dangerous-protect-the-kids-ballot-initiative/,https://www.techdirt.com/wp-content/themes/techdirt/assets/images/td-rect-logo-white.png
44,"Politicians Are Using Kids As Props To Pass Terrible, Harmful Legislation. Don’t Let Them Get Away With It","Amidst all of the attention paid to last week’s Senate hearing on child safety online, it remains stunning just how little time was actually spent on how to help children online. Instead, we saw pure theatrical nonsense, with Senators insisting (falsely) that…","from the fixing-societal-issues-is-hard,-blaming-social-media-is-easy dept
Amidst all of the attention paid to last weeks Senate hearing on child safety online, it remains stunning just how little t… [+11807 chars]",Mike Masnick,2024-02-05T17:27:02Z,,https://www.techdirt.com/2024/02/05/politicians-are-using-kids-as-props-to-pass-terrible-harmful-legislation-dont-let-them-get-away-with-it/,https://www.techdirt.com/wp-content/themes/techdirt/assets/images/td-rect-logo-white.png
57,Masturbation Abstinence Is Popular Online. Doctors And Therapists Are Worried,More than two decades of growing internet use has surfaced fears about the social and psychological impacts of nearly unfettered access to pornography. But many researchers and sex therapists worry that the online communities that have formed in response to t…,"There is a thriving landscape of social media content, online forums and entrepreneurs dedicated to helping men suppress the urge to masturbate to pornography.
Joe Gough for NPR
""Nothing scares me.… [+23530 chars]",Lisa Hagen,2024-02-05T13:59:34Z,,https://www.npr.org/2026/01/01/1198916105/mens-health-masturbation-abstinence,https://media.npr.org/assets/img/2024/01/24/mens-health-disinfo1_wide-01c0052c21678df21865a56b6370ebf66d82fceb-s1400-c100.jpg
65,Sundance 2024: How 8 Editors Overcame Cutting Room Challenges,Adobe Creative Cloud shapes compelling stories debuting at the Park City festival.,"Presented by Adobe, Presenting Sponsor and official editing solution of the 2024SundanceFilm Festival. For more information, click here.
“Risk…can be the catalyst that propels you forward” is a quot… [+19658 chars]",Christian Blauvelt,2024-01-21T15:42:04Z,,https://www.indiewire.com/features/brand-content/sundance-2024-how-8-editors-overcame-cutting-room-challenges-1234945231/,https://www.indiewire.com/wp-content/uploads/2024/01/seekingmavisbeacon.jpg
80,How Republican donor class blew another election...,"How Republican donor class blew another election...

 
 
 
 (Top headline, 3rd story, link)

 

 

 
 Related stories:Haley needs jolt to stop Trump in NH. But where's the energy?
'Absolutely' Could Win, GOP Chairman Says...
DeSantis cancels TV show app…","In the waning days of 2023, the last weeks of the before-time the moments before the Republican Party would inevitably crown the once and future king who rules upon high from Mar-a-Lago the billionai… [+12606 chars]",Ben Domenech,2024-01-21T13:58:36Z,,http://thespectator.com/politics/fall-nikki-haley-comet-trump-2024/,https://thespectator.com/wp-content/uploads/2024/01/B-DOM.jpg
83,"‘Harry Potter’ TV Series On Max: Everything We Know About The Cast, Release Date, What J.K. Rowling Says & More","At its Max streaming event earlier this year, Warner Bros. Discovery confirmed a new era is coming for Harry Potter fans. The company announced a TV series based on all seven books about the boy wizard written by J.K. Rowling. See below for the most current a…","At its Maxstreaming event earlier this year, Warner Bros. Discoveryconfirmed a new era is coming for Harry Potter fans. The company announced a TV series based on all seven books about the boy wizard… [+10627 chars]",tomt,2024-01-19T02:50:13Z,,http://deadline.com/2024/01/harry-potter-tv-series-max-release-date-cast-1235323284/,https://deadline.com/wp-content/uploads/2023/04/Screen-Shot-2023-04-12-at-2.00.34-PM.png?w=1024
84,"‘Harry Potter’ TV Series On Max: Everything We Know About The Cast, Release Date, What J.K. Rowling Says & More","At its Max streaming event in April 2023, Warner Bros. Discovery confirmed a new era is coming for Harry Potter fans. The company announced a TV series based on all seven books about the boy wizard written by J.K. Rowling. See below for the most current answe…","At its Maxstreaming event in April 2023, Warner Bros. Discoveryconfirmed a new era is coming for Harry Potter fans. The company announced a TV series based on all seven books about the boy wizard wri… [+13709 chars]",tomt,2024-02-02T00:59:16Z,,http://deadline.com/2024/02/harry-potter-tv-series-max-release-date-cast-1235323284/,https://deadline.com/wp-content/uploads/2023/04/Screen-Shot-2023-04-12-at-2.00.34-PM.png?w=1024
90,Court to Oregon Republicans: That Stupid Boycott Is Going to Cost You,"The Oregon Supreme Court ruled Thursday that 10 Republican state senators haved disqualified themselves from the upcoming election, after staging a record-long walkout last year to block bills on abortion access, transgender health care, and gun restrictions.…","But third-party translations of Omars speech, published in full by The Minnesota Reformer, reveal that Omar never actually said any of that. TheReformercommissioned two translations, and neither show… [+759 chars]",Tori Otten,2024-02-01T19:06:00Z,,https://newrepublic.com/post/178660/oregon-supreme-court-republicans-boycott-reelection,https://images.newrepublic.com/69c4208accfe24cd78e4b1e8fcb0dfdd6b0fc7de.jpeg?w=1200&h=630&crop=faces&fit=crop&fm=jpg
91,The Entire Internet Comes Together to Drag Pathetic Ron DeSantis,"You have to hand it to Ron DeSantis: the man successfully brought a divided country together. Just not in the way he wanted.
The Florida governor on Sunday ended his presidential campaign, a run that was arguably more embarrassing to watch than for him to ac…","A spokesperson for Murphys campaign told the outlet that the comments and calls were made by a young person with no connection to our campaign, one who seemed eager to help, albeit in a misguided man… [+1203 chars]",Tori Otten,2024-01-22T15:08:42Z,,https://newrepublic.com/post/178291/entire-internet-drag-ron-desantis-drop-out-race,https://images.newrepublic.com/e1b7cef223b102e38ae705cba56f21899911e85d.jpeg?w=1200&h=630&crop=faces&fit=crop&fm=jpg
92,I Really Hate It When Robert F. Kennedy Jr. Is Right,"We used to see “plastic” as
the epitome of what humans, and all living things, were not. The phrase
“plastic people”—memorialized in a 1960s-era songs and a band name—was a metaphor for materialism and conformity, representing a fear that under
consumer capit…","But the need to refute such
misinformation shouldnt obscure the seriousness of what we do know
about microplastics. Researchers like the Dutch scientist who co-authored one
of the recent studies a… [+1400 chars]",Liza Featherstone,2024-01-29T11:00:00Z,,https://newrepublic.com/article/178468/really-hate-robert-f-kennedy-jr-right,https://images.newrepublic.com/ae9f3d2c01ae1a4fbf311e0c5da0a540d9041652.jpeg?w=1200&h=630&crop=faces&fit=crop&fm=jpg
93,How Surveillance Is Changing Our Most Intimate Relationships,"When was the last time you were most alone? In your house with the shades drawn? Your car with the doors locked? What did you do without people around you, comfortably anonymous—spit, cry, watch porn, stalk your ex, pick at your skin? How did it feel to be fr…","We have consumer privacy, we have protection from government surveillance, Behrend said. There are currently no protections for workers when it comes to workplace surveillance. We dont need a lot of … [+1531 chars]",Julia Sonenshein,2024-01-28T11:00:00Z,,https://newrepublic.com/article/178268/surveillance-changing-intimate-relationships,https://images.newrepublic.com/494556f38c7750381a578f67cc3ca9f7a8e739d2.jpeg?w=1200&h=630&crop=faces&fit=crop&fm=jpg
