,title,description,content,author,publishedAt,source,url,urlToImage
183,"‘Il Careggi ha salvato mio figlio: trattato come un caso psichiatrico, voleva solo essere un ragazzo’","“Claudia molto presto mi ha detto di essere una bambina. Io non pensavo nemmeno che fosse possibile, all’inizio pensavo si sbagliasse. Era ossessionata dal suo corpo. Un’ansia costante quando pensava che sarebbe diventata come il suo papà. Mi chiedeva tutti i…","Claudia molto presto mi ha detto di essere una bambina. Io non pensavo nemmeno che fosse possibile, allinizio pensavo si sbagliasse. Era ossessionata dal suo corpo. Unansia costante quando pensava ch… [+5477 chars]",Camilla Vivian,2024-01-24T12:30:04Z,,https://www.ilfattoquotidiano.it/2024/01/24/ispezione-ministero-careggi-disforia-di-genere-hanno-salvato-mio-figlio/7420747/,https://st.ilfattoquotidiano.it/wp-content/uploads/2022/03/19/variant-med_1200x630-obj27311035.jpg
184,"A secret shelf of banned books thrives in a Texas school, under the nose of censors","A teacher at a public school near Houston has a secret classroom bookshelf largely made up of challenged titles. Many of the books deal with race, sex and gender.","The secret bookshelf began in late 2021, when then-state Rep. Matt Krause sent public schools a list of 850 books he wanted banned from schools. They might, he said, “make students feel discomfort, g… [+3622 chars]",Kara Newhouse,2024-01-29T18:16:15Z,,https://www.kqed.org/mindshift/63035/a-secret-shelf-of-banned-books-thrives-in-a-texas-school-under-the-nose-of-censors,https://cdn.kqed.org/wp-content/uploads/sites/23/2024/01/book-pages-lined-up-1-credit-becky-harlan-npr_custom-695113afbb848e7e5407942b314b98ac94783781-1020x679.jpg
188,Georgia GOP “Women’s Rights” Bill Is Exactly What You’d Expect—or Worse,"Georgia Republicans have introduced a bill they have dubbed the “Women’s Bill of Rights.” But in reality, the measure would expose women, both cis- and transgender, to increased violence and discrimination.
House Bill 1128 was introduced Friday by a group of…","As [the National Archives and Records Administration] attempted to carry out its statutory responsibilities from 2021 into 2022, highly classified documents sat in a ballroom, bathroom, office space,… [+784 chars]",Tori Otten,2024-02-05T21:52:48Z,,https://newrepublic.com/post/178759/georgia-republicans-womens-rights-bill-lgbtq,https://images.newrepublic.com/439874733c885723e14d9df61b5968a31159c6b7.jpeg?w=1200&h=630&crop=faces&fit=crop&fm=jpg
189,Due noir potenti che affrontano problemi complessi e spesso dimenticati,"I noir della coppia Flumerti&Giacometti e di Flaminia P. Mancinelli affrontano temi importanti a volte scomodi o dimenticati. Le protagoniste, Luce Giordano e Giulia Magnani, operano a Roma e combattono contro i criminali, ma sono consapevoli che il “male” a …","I noir della coppia Flumerti&amp;Giacometti e di Flaminia P. Mancinelli affrontano temi importanti a volte scomodi o dimenticati. Le protagoniste, Luce Giordano e Giulia Magnani, operano a Roma e com… [+3854 chars]",Marinella Zetti,2024-01-28T08:46:42Z,,https://www.ilfattoquotidiano.it/2024/01/28/due-noir-potenti-che-affrontano-problemi-complessi-e-spesso-dimenticati/7423125/,https://st.ilfattoquotidiano.it/wp-content/uploads/2024/01/26/libri-noir-1200.jpg
190,Hold on Idaho’s gender-affirming care ban remains in place for transgender kids,,"Si vous cliquez sur « Tout accepter », nos partenaires (y compris 244 qui font partie du Cadre de transparence et de consentement dIAB) et nous utiliserons également des témoins et vos données person… [+982 chars]",,2024-01-31T00:08:37Z,,https://consent.yahoo.com/v2/collectConsent?sessionId=1_cc-session_33e99603-2010-439f-98a1-12009aeac9f6,
191,Teen Girl Faces Harassment After Utah Official Falsely Suggests She's Transgender,,"Si vous cliquez sur « Tout accepter », nos partenaires (y compris 243 qui font partie du Cadre de transparence et de consentement dIAB) et nous utiliserons également des témoins et vos données person… [+982 chars]",,2024-02-09T00:22:47Z,,https://consent.yahoo.com/v2/collectConsent?sessionId=1_cc-session_f31ec6be-f5c3-470d-8667-6acdcece8d37,
192,"Former Kansas prison employee says she was harassed for being transgender, files lawsuit","In a lawsuit, Shelly Lamb says she was not allowed to use the women’s restroom and was moved to a basement office that had been a supply closet.","A transgender woman alleges she faced discrimination while working for the Kansas Department of Corrections, including not being allowed to use the womens restroom and being moved to a basement offic… [+1420 chars]",Katie Moore,2024-01-24T19:10:11Z,,https://www.kansascity.com/news/state/kansas/article284628270.html,https://media.zenfs.com/en/kansas_city_star_mcclatchy_articles_677/0f9a6d9bf453f161a2c47e0cdc9cb26f
193,"Utah Gov. signs anti-trans bathroom bill, which advocates say is 'harassment in the most private of settings'","Utah's contentious transgender bathroom ban is officially signed into law after Republican Gov. Spencer Cox signed the bill late Tuesday, per multiple outlets, just days after state lawmakers pushed the legislation through.","Utah's contentious transgender bathroom ban is officially signed into law after Republican Gov. Spencer Cox signed the bill late Tuesday, per multiple outlets, just days after state lawmakers pushed … [+2141 chars]",Ryan Adamczeski,2024-01-31T19:23:22Z,,https://www.advocate.com/law/utah-transgender-bathroom-bill-governor,https://www.advocate.com/media-library/utah-governor-spencer-cox-signs-anti-trans-bathroom-bill-high-school-student-affected-transgender-bans.jpg?id=51245331&width=1200&height=600&coordinates=0%2C0%2C0%2C78
194,LGBTQ+ people ‘are not going anywhere’ says GLAAD CEO ahead of Emmy Awards honor,"While Republican lawmakers in legislatures around the country have targeted transgender visibility in an assault on the rights of LGBTQ+ people, the most popular television awards will honor the LGBTQ+ advocacy group GLAAD.","While Republican lawmakers in legislatures around the country have targeted transgender visibility in an assault on the rights of LGBTQ+ people, the most popular television awards will honor the LGBT… [+2452 chars]",Christopher Wiggins,2024-01-15T14:00:03Z,,https://www.advocate.com/news/glaad-governors-award-emmys,https://www.advocate.com/media-library/sarah-kate-ellis-and-emmy-statue.jpg?id=51074393&width=1200&height=600&coordinates=0%2C0%2C0%2C78
195,A SANE VIEW ON AN INSANE SUBJECT:  Son of photographer David Bailey claims online chat rooms groome,A SANE VIEW ON AN INSANE SUBJECT:  Son of photographer David Bailey claims online chat rooms groomed him into being transgender. Particularly what he says about minors.,"InstaPundit is a participant in the Amazon Services LLC Associates Program, an affiliate advertising program designed to provide a
 means for sites to earn advertising fees by advertising and linkin… [+15 chars]",Sarah Hoyt,2024-01-23T10:35:36Z,,https://instapundit.com/628250/,https://instapundit.com/wp-content/themes/instapundit/images/opengraph-default.png
196,"„Damit bewährt sich, öffentlich über diese Übergriffe zu sprechen“","Die Bloggerin Rona Duwe, die sich kritisch zum Selbstbestimmungsrecht äußert, war von der Polizei zur erkennungsdienstlichen Behandlung vorgeladen worden. WELT berichtete über den Fall. Nun hob Polizei die Anordnung auf. Eine Anklage droht Duwe trotzdem.","Die polizeiliche Vorladung der Bloggerin Rona Duwe, bei der sie erkennungsdienstlich behandelt werden sollte, ist zurückgezogen worden. Die Polizei Dortmund teilte Duwe mit, dass nach Abwägung der Sa… [+5190 chars]",Anna Kröning,2024-01-26T14:07:46Z,,https://www.welt.de/politik/deutschland/article249743122/Trans-Debatte-Damit-bewaehrt-sich-oeffentlich-ueber-diese-Uebergriffe-zu-sprechen.html,https://img.welt.de/img/politik/deutschland/mobile249744288/2221358377-ci16x9-w1200/woman-using-laptop.jpg
197,"USA Boxing’s New Transgender Rule Could ‘Kill a Woman,’ Coach Warns","USA Boxing has changed its rules to allow men who identify as women to compete in the female category, a change that coach Cary Williams... Read More
The post USA Boxing’s New Transgender Rule Could ‘Kill a Woman,’ Coach Warns appeared first on The Daily Sign…","USA Boxing has changed its rules to allow men who identify as women to compete in the female category, a change that coach Cary Williams warns could be deadly. 
Even one man competing against women … [+14308 chars]",Virginia Allen,2024-01-17T00:18:03Z,,https://www.dailysignal.com/2024/01/16/usa-boxings-new-transgender-rule-could-kill-a-woman-coach-warns/,https://first-heritage-foundation.s3.amazonaws.com/live_files/2024/01/Boxing.jpg
198,"Snap Breaks Under Pressure, Supports Dangerous KOSA Bill That Will Put Kids In Danger","Over and over again, we see politicians browbeat companies until they agree to support terrible legislation. Back when FOSTA was being debated, there was tremendous pressure from the media and Congress for tech to support it, falsely claiming that without it …","from the scabs dept
Over and over again, we see politicians browbeat companies until they agree to support terrible legislation. Back when FOSTA was being debated, there was tremendous pressure from… [+3777 chars]",Mike Masnick,2024-01-29T17:33:00Z,,https://www.techdirt.com/2024/01/29/snap-breaks-under-pressure-supports-dangerous-kosa-bill-that-will-put-kids-in-danger/,https://www.techdirt.com/wp-content/themes/techdirt/assets/images/td-rect-logo-white.png
199,Ohio Republicans override governor's veto to pass gender-affirming care ban and sports ban,Ohio’s legislature has overridden Gov. Mike DeWine’s veto and banned gender-affirming care for transgender minors and barred trans girls and women from participating in female sports in public schools and colleges.,Ohios legislature has overridden Gov. Mike DeWines veto and banned gender-affirming care for transgender minors and barred trans girls and women from participating in female sports in public schools … [+4666 chars],Trudy Ring,2024-01-24T21:30:46Z,,https://www.advocate.com/politics/ohio-anti-trans-law-passed,https://www.advocate.com/media-library/ohio-governor-mike-dewine-podium-state-flag-transgender-student-playing-boys-high-school-basketball.jpg?id=51178169&width=1200&height=600&coordinates=0%2C6%2C0%2C72
200,North Carolina Republican says trans people should ‘find a corner outside somewhere’ to go to the bathroom,"North Carolina Republican Lt. Gov. Mark Robinson seems to want to ban transgender people from using the bathroom that most aligns with their gender identity. Yes, the same kind of “bathroom bill” that failed almost seven years.","North Carolina Republican Lt. Gov. Mark Robinson seems to want to ban transgender people from using the bathroom that most aligns with their gender identity. Yes, the same kind of bathroom bill that … [+2796 chars]",Alex Cooper,2024-02-10T18:38:25Z,,https://www.advocate.com/politics/mark-robinson-trans-bathroom-nc,https://www.advocate.com/media-library/image.jpg?id=51439467&width=1200&height=600&coordinates=0%2C0%2C0%2C78
201,Transgender women have a higher risk of HIV infections. A new CDC report reveals why,"While transgender women have disproportionately high rates of HIV, the population has been routinely left out of critical research involving infection prevention measures. A new study is finally beginning to bridge the gap.","While transgender women have disproportionately high rates of HIV, the population has been routinely left out of critical research involving infection prevention measures. A new study is finally begi… [+2839 chars]",Ryan Adamczeski,2024-01-28T22:17:36Z,,https://www.advocate.com/news/transgender-women-hiv-infections-discrimination,https://www.advocate.com/media-library/transgender-women-lower-access-to-hiv-aids-care-medication.jpg?id=51188332&width=1200&height=600&coordinates=0%2C0%2C0%2C78
202,How to be a good ally to trans people,"In 2024, UK politics is plagued by open transphobia, and messages from 2019’s inaugural trans pride march are as vital as ever","On February 2, the murderers of Brianna Ghey were sentenced to life in prison, after they were found guilty of killing the 16-year-old transgender girl in a premeditated attack back in February 2023.… [+101 chars]",Brit Dawson,2024-02-08T15:00:00Z,,https://www.dazeddigital.com/life-culture/article/46089/1/how-to-be-an-ally-london-trans-pride-brianna-ghey-rishi-sunak-2024?utm_source=Link&utm_medium=Link&utm_campaign=RSSFeed&utm_term=how-to-be-a-good-ally-to-trans-people,
203,‘Dark Fantasies’: Two Teenage Suspects Sentenced For Killing Transgender Teen,A judge in northwest England Friday sentenced two teens convicted of killing a transgender teen to life imprisonment with parole possible after 20 and 22 years,"A judge in northwest England Friday sentenced two teenagers convicted of killing a transgender teenager to life imprisonment with the option of parole after 20 and 22 years.
Scarlett Jenkinson and E… [+2082 chars]",John Oyewale,2024-02-03T02:27:58Z,,https://dailycaller.com/2024/02/02/scarlett-jenkinson-eddie-ratcliffe-sentenced-murder-transgender-teenager-brianna-ghey-manchester-england/,https://cdn01.dailycaller.com/wp-content/uploads/2024/02/Capture-2-e1706924362311.jpg
204,Transgender Social Media Star Pleads Guilty To Child Abuse: REPORT,"'I felt like a bird trapped in a cage, all I wanted was to be free … I still worry that you will find me'","Australian transgender TikToker Rachel Queen Burton pleaded guilty Tuesday to aggravated child abuse offenses, including producing and possessing child exploitation material, gross indecency and inde… [+3184 chars]",Hailey Gomez,2024-02-08T00:18:16Z,,https://dailycaller.com/2024/02/07/transgender-social-media-star-pleads-guilty-to-child-abuse-report/,https://cdn01.dailycaller.com/wp-content/uploads/2024/02/GettyImages-1258626528-e1707349766280.jpg
205,Kentucky's first transgender elected official wants you to get involved in local politics,Rebecca Blankenship recently spoke to The Advocate about how LGBTQ+ people can fight back against state legislatures' attacks on the community.,"Kentucky
 legislators passed some of the nations worst anti-LGBTQ+ laws
 in 2023. 
Alongside bans on gender-affirming care for minors and bans on teaching LGBTQ+ topics in public schools, the stat… [+4999 chars]",Ryan Adamczeski,2024-02-02T17:30:56Z,,https://www.advocate.com/politics/rebecca-blankenship-kentucky-transgender-elected,https://www.advocate.com/media-library/rebecca-blankenship-kentucky-transgender-politician.jpg?id=51222384&width=1200&height=600&coordinates=0%2C0%2C0%2C78
206,The Supreme Court declines to step into the fight over bathrooms for transgender students,,"Si vous cliquez sur « Tout accepter », nos partenaires (y compris 244 qui font partie du Cadre de transparence et de consentement dIAB) et nous utiliserons également des témoins et vos données person… [+982 chars]",,2024-01-16T15:17:27Z,,https://consent.yahoo.com/v2/collectConsent?sessionId=1_cc-session_25077fda-4f01-42ab-80f0-28252156d9a4,
207,Transgender veterans sue to have gender-affirming surgery covered by Department of Veteran Affairs,,"Si vous cliquez sur « Tout accepter », nos partenaires (y compris 244 qui font partie du Cadre de transparence et de consentement dIAB) et nous utiliserons également des témoins et vos données person… [+982 chars]",,2024-01-25T15:24:15Z,,https://consent.yahoo.com/v2/collectConsent?sessionId=1_cc-session_89452751-7a51-4cd2-9914-6e643b599427,
208,Ohio overrides governor's veto to ban transgender medical treatment involving children,,"Si vous cliquez sur « Tout accepter », nos partenaires (y compris 244 qui font partie du Cadre de transparence et de consentement dIAB) et nous utiliserons également des témoins et vos données person… [+982 chars]",,2024-01-25T01:59:14Z,,https://consent.yahoo.com/v2/collectConsent?sessionId=1_cc-session_4375c7ad-b965-4f89-8c56-c220984756ef,
209,Palette: Psychological Horror Thriller Adds Hunter Schafer & Noomi Rapace to Cast,"Palette, the feature-length directorial debut of Zach Straus, has now added Hunter Schafer and Noomi Rapace to the cast of the psychological horror thriller. Palette Story and Cast Details In Palette, Schafer is Dolly, a woman suffering from extreme synesthes…","Palette, the feature-length directorial debut of Zach Straus, has now added Hunter Schafer and Noomi Rapace to the cast of the psychological horror thriller.
In Palette, Schafer is Dolly, a woman su… [+998 chars]",Neil Bolt,2024-02-07T15:52:23Z,,https://www.comingsoon.net/movies/news/1530509-palette-casting,"https://www.comingsoon.net/wp-content/uploads/sites/3/2024/02/palette-cast.jpg?resize=1200,630"
210,N.H. lawmakers consider multiple bills targeting transgender students and athletes,At least 20 states have approved a version of a blanket ban on transgender athletes playing on K-12 and collegiate sports teams.,"Michelle Cilley Foisy, of Temple, told the committee she broke track and field records in high school, won a state championship as part of a relay team and attended college on an athletic scholarship… [+2127 chars]",Holly Ramer,2024-01-31T02:51:30Z,,https://www.bostonglobe.com/2024/01/30/metro/nh-lawmakers-consider-multiple-bills-targeting-transgender-students-athletes/,https://bostonglobe-prod.cdn.arcpublishing.com/resizer/jM3rErI0xkJb0vtBwsbhlqXxCak=/506x0/cloudfront-us-east-1.images.arcpublishing.com/bostonglobe/7ME2PLLIFUBUJRYPWUQ22PYEEM.jpg
211,Sunak declines to apologise over PMQs trans comment,Brianna Ghey's father called for the prime minister to say sorry for a joke made during PMQs on Wednesday.,"Rishi Sunak has declined to apologise to Brianna Ghey's father after joking about Labour's position on trans people.
The Prime Minister insisted his comment during PMQs was ""absolutely legitimate"" b… [+353 chars]",,2024-02-08T11:43:51Z,bbc-news,https://www.bbc.co.uk/news/av/uk-politics-68238784,https://ichef.bbci.co.uk/news/1024/branded_news/D17D/production/_132592635_p0h9qy9q.jpg
212,EXCLUSIVE: ADL Urged Law Enforcement to Target Opponents of Transgender Ideology,"FIRST ON THE DAILY SIGNAL: The Anti-Defamation League flags “online amplifiers of LGBTQ+ hate” as extremists to be examined by law enforcement, a newly unearthed... Read More
The post EXCLUSIVE: ADL Urged Law Enforcement to Target Opponents of Transgender Ide…","FIRST ON THE DAILY SIGNAL: The Anti-Defamation League flags “online amplifiers of LGBTQ+ hate” as extremists to be examined by law enforcement, a newly unearthed email shows. 
The revelation indicat… [+12062 chars]",Mary Margaret Olohan,2024-01-24T19:00:00Z,,https://www.dailysignal.com/2024/01/24/exclusive-adl-urged-law-enforcement-target-opponents-transgender-ideology/,https://first-heritage-foundation.s3.amazonaws.com/live_files/2024/01/GettyImages-1244131417-scaled.jpg
213,British teens who killed transgender teen Brianna Ghey named ahead of sentencing,"A judge reveals the identities of Scarlett Jenkinson and Eddie Ratcliffe, as they wait to hear their prison sentences.","<ul><li>In short: A judge has lifted a ban on reporting the identities of British teenagers Scarlett Jenkinson and Eddie Ratcliffe, during their sentencing hearing for the murder of transgender teena… [+2098 chars]",ABC News,2024-02-02T12:03:47Z,abc-news-au,https://www.abc.net.au/news/2024-02-02/brianna-ghey-teens-scarlett-jenkinson-eddie-ratcliffe-sentencing/103422508,https://live-production.wcms.abc-cdn.net.au/aa7a9076f60556f0a5c9cb84e3cd6842?impolicy=wcms_crop_resize&cropH=1058&cropW=1881&xPos=114&yPos=0&width=862&height=485
214,Governing Body Rules Trans Irish Dancers Can Compete in Gender Categories of Their Choosing,"Transgender Irish dancers can compete in whatever categories they say matches their chosen gender identity, the governing body for the discipline has ruled.","Transgender Irish dancers can compete in whatever categories they say matches their chosen gender identity, the governing body for the discipline has ruled.
An Coimisiún Le Rincí Gaelacha (CLRG) mad… [+2413 chars]","Simon Kent, Simon Kent",2024-02-09T10:54:37Z,breitbart-news,https://www.breitbart.com/entertainment/2024/02/09/governing-body-rules-trans-irish-dancers-can-compete-in-gender-categories-of-their-choosing/,https://media.breitbart.com/media/2024/02/irish-dancing-640x335.jpg
215,‘I Was Scared’: Ex-Therapist Says Hospital Required Her To Misdiagnose Troubled Teens As Trans,A former therapist said her hospital required her to diagnose “all teenagers with gender dysphoria” as transgender.,"A former therapist said her hospital required her to diagnose “all teenagers with gender dysphoria” as transgender.
Tamara Pietkze said she quit her job as a therapist of six years at MultiCare afte… [+1958 chars]",Julianna Frieman,2024-02-05T22:02:30Z,,https://dailycaller.com/2024/02/05/ex-therapist-hospital-require-misdiagnose-trouble-teens-trans/,https://cdn01.dailycaller.com/wp-content/uploads/2024/02/GettyImages-1563491812-2-scaled-e1707169928171.jpg
216,Will & Harper: When Did Harper Steele Come Out as Trans?,"Showcasing a beautiful tale of friendship, this year’s Sundance Film Festival saw the premiere of the heart-touching documentary Will & Harper. As the title suggests, the people under the spotlight are celebrated actor/comedian Will Ferrell and his good frien…","Showcasing a beautiful tale of friendship, this years Sundance Film Festival saw the premiere of the heart-touching documentary Will &amp; Harper. As the title suggests, the people under the spotligh… [+2984 chars]",Debangshu Nath,2024-01-29T10:47:12Z,,https://www.comingsoon.net/documentaries/news/1507214-will-and-harper-when-did-harper-steele-come-out-as-trans,"https://www.comingsoon.net/wp-content/uploads/sites/3/2024/01/Untitled-design-83-1.jpg?resize=1200,630"
217,Will & Harper: How Long Have Will Ferrell and Harper Steele Been Friends?,"This year’s Sundance Film Festival saw the premiere of a new documentary titled Will & Harper, showcasing the beautiful friendship between comedian Will Ferrell and his best friend, Harper Steele. The duo met when they worked together on Saturday Night Live a…","This years Sundance Film Festival saw the premiere of a new documentary titled Will &amp; Harper, showcasing the beautiful friendship between comedian Will Ferrell and his best friend, Harper Steele.… [+2976 chars]",Debangshu Nath,2024-01-29T08:19:38Z,,https://www.comingsoon.net/documentaries/news/1507039-will-and-harper-how-long-have-will-ferrell-and-harper-steele-been-friends,"https://www.comingsoon.net/wp-content/uploads/sites/3/2024/01/Untitled-design-82-4.jpg?resize=1200,630"
218,EXCLUSIVE: Top Trans Pediatric Doctors Admit In Unearthed Video That Puberty Blockers Aren’t As ‘Reversible’ As Advertised,"Prominent World Professional Association for Transgender Health (WPATH) physicians acknowledged that puberty blockers are more invasive than portrayed in the media and can have irreversible effects on minors such as infertility, bone loss and disruption of br…",Prominent World Professional Association for Transgender Health (WPATH) physicians acknowledged that puberty blockers are more invasive than portrayed in the media and can have irreversible effects o… [+5778 chars],Megan Brock,2024-01-16T12:47:48Z,,https://dailycaller.com/2024/01/16/child-sex-changes-pediatric-puberty-hormones/,https://cdn01.dailycaller.com/wp-content/uploads/2024/01/Screenshot-2024-01-16-073630-e1705408683162.jpg
219,'Big comedown' as DeSantis abandons New Hampshire,DeSantis’ brand of conservatism was never a natural fit for the Granite State.,"Its a big comedown for somebody who a year ago looked like he was going to be the one to take on Trump, said Jon McHenry, a vice president at North Star Opinion Research Group whose firm worked on De… [+5612 chars]",Kimberly Leonard and Lisa Kashinsky,2024-01-17T23:49:47Z,politico,https://www.politico.com/news/2024/01/17/desantis-new-hampshire-south-carolina-strategy-00136239,https://static.politico.com/34/72/63fd07b54f35a9ebe8bbdd632d31/election-2024-south-carolina-desantis-02142.jpg
220,Danielle Smith bids to transcend politics with Canada's toughest trans youth rules,"Transitioning minors will face new restrictions in health care, education and sports. Alberta's top politician declares changes, but doesn't want it all politicized.","Premier Danielle Smith swore for months that she didn't want to politicize issues around the rights and aspirations of transgender, gender-fluid or questioning youth, and has now declared Canada's mo… [+5555 chars]",,2024-02-02T09:00:00Z,cbc-news,https://www.cbc.ca/news/canada/calgary/trans-youth-restrictions-canadas-toughest-danielle-smith-politicized-analysis-1.7102590,https://i.cbc.ca/1.7102599.1706838608!/cpImage/httpImage/image.jpg_gen/derivatives/16x9_620/alta-trans-students-20240201.jpg
221,Transgender Democrat Permitted to Run for Ohio Office Despite Hiding Former Name,A transgender candidate has been permitted to run for a seat in the Ohio House despite hiding his original name on documents.,"A transgender candidate has been permitted to run for a seat in the Ohio House despite hiding his original name on documents required by state elections law.
The Mercer County Board of Elections cho… [+1656 chars]","Alana Mastrangelo, Alana Mastrangelo",2024-01-23T02:22:50Z,breitbart-news,https://www.breitbart.com/politics/2024/01/22/transgender-democrat-permitted-to-run-for-ohio-office-despite-hiding-former-name/,https://media.breitbart.com/media/2024/01/Arienne-Childrey-640x335.jpeg
