,title,description,content,author,publishedAt,source,url,urlToImage
359,"Where there’s a will, there’s a way: Ohio Senate overrides Gov. Mike DeWine’s veto of bill that bans transgender drugs and surgery for minors","The Ohio Senate successfully overrode the veto of Republican Governor Mike DeWine, who rejected a bill that bans transition-related medical care for transgender minors and restricts the participation of trans athletes in sports competitions for girls. House B…","Major medical associations, including the American Medical Association, the American Academy of Pediatrics and the American Psychological Association, also support minors through access to gender-aff… [+1137 chars]",Laura Harris,2024-01-30T06:00:00Z,,https://www.naturalnews.com/2024-01-30-ohio-senate-overrides-veto-transgender-drugs-surgery-ban.html,https://www.naturalnews.com/wp-content/uploads/sites/91/2024/01/Transgender-Gender-Dysphoria-Flag-Hand-Palm.jpg
360,Quiz: How well do you know queer reality TV?,Calling all reality TV buffs! Think you know your queer reality shows inside out? Prove it with our trivia quiz!,"From the ground-breaking moments to the heart-warming love stories, queer reality TV shows have been shaping the landscape of television for years now. 
These shows not only entertain us but also pl… [+3658 chars]",Ian Helms,2024-01-25T20:00:00Z,,https://www.queerty.com/quiz-how-well-do-you-know-queer-reality-tv-20240125,https://adabgmwwup.cloudimg.io/v7/_queerty-prodweb_/2024/01/reality-tv-quiz.png?auto=format&auto=compress&fit=crop&gravity=smart&w=1200&h=630&force_format=jpeg&wat=1&wat_gravity=southeast&wat_pad=70
361,"Women Take Top Grammys, Yet Oscars Still Bar Female Actors From Competing With Men","Female artists swept the top honors at the Grammy Awards. But at the Academy Awards, women won’t even be permitted to compete with men in several categories.","Women, including Taylor Swift, dominated the Grammy Awards (Photo by Axelle/Bauer-Griffin/FilmMagic)
FilmMagic
The spotlight was on female artists who swept the top honors at the Grammy Awards last… [+3640 chars]","Kim Elsesser, Senior Contributor, 
 Kim Elsesser, Senior Contributor
 https://www.forbes.com/sites/kimelsesser/",2024-02-05T19:25:46Z,,https://www.forbes.com/sites/kimelsesser/2024/02/05/women-take-top-grammys-yet-oscars-still-bar-female-actors-from-competing-with-men/,https://imageio.forbes.com/specials-images/imageserve/65c12d77b7da0503f89854c0/0x0.jpg?format=jpg&height=900&width=1600&fit=bounds
362,"Suspect transitioning to a woman fatally stabbed mother 58 times, tossed small dog to its death off 11th floor: Police","An alleged transgender suspect stabbed his mother to death at her home in New York City and threw her dog to its death off the 11th floor, according to police. Andre Eugene, 36, was reportedly charged with murder, aggravated cruelty to animals, and criminal p…","An alleged transgender suspect stabbed his mother to death at her home in New York City and threw her dog to its death off the 11th floor, according to police. 
Andre Eugene, 36, was reportedly char… [+2038 chars]",Paul Sacca,2024-01-26T00:34:47Z,,https://www.theblaze.com/news/transgender-suspect-stabbed-mother-dog-killed,https://www.theblaze.com/media-library/image.jpg?id=51189912&width=1200&height=600&coordinates=0%2C14%2C0%2C46
363,WHO panel that will draft children’s healthcare policies includes 11 members with no medical background and 7 transgender activists,"Eleven of the 21 World Health Organization‘s (WHO) healthcare policy committee members are not qualified medical experts and seven are transgender. According to a report by the Daily Mail, only 10 members of the panel are medical practitioners. One of the mem…","Eleven of the 21 World Health Organization's (WHO) healthcare policy committee members are not qualified medical experts and seven are transgender. According to a report by the Daily Mail, only 10 me… [+5176 chars]",Belle Carter,2024-01-16T06:00:00Z,,https://www.naturalnews.com/2024-01-16-who-panel-children-healthcare-includes-trans-activists.html,https://www.naturalnews.com/wp-content/uploads/sites/91/2024/01/WHO-symbol.jpg
364,Map: Where states stand on health care for transgender minors,At least 22 states have enacted bans on gender affirming care for children.,"By Andrew DeMillo and Hannah Schoenbaum, Associated Press
Republican-led state legislatures are considering a new round of bills restricting medical care for transgender youths and in some cases, ad… [+3210 chars]",Associated Press,2024-01-18T19:40:11Z,,https://www.bostonherald.com/2024/01/18/map-where-states-stand-on-health-care-for-transgender-minors/,https://www.bostonherald.com/wp-content/uploads/2024/01/AP24010656657261.jpg?w=1024&h=683
365,ABSURD: Canadian doctor slapped with 3-month suspension for not using MALE pronouns to address FEMALE patient,"A doctor in Canada was slapped with a three-month suspension for “misgendering” his female-to-male (FTM) transgender patient – a biological woman pretending to be a man. On Jan. 3, the Quebec College of Physicians (CMQ) issued a suspension order to Dr. Raymon…","A doctor in Canada was slapped with a three-month suspension for ""misgendering"" his female-to-male (FTM) transgender patient a biological woman pretending to be a man.
On Jan. 3, the Quebec College … [+4871 chars]",Olivia Cook,2024-01-24T06:00:00Z,,https://www.naturalnews.com/2024-01-24-canadian-doctor-slapped-with-suspension-misgendering-patient.html,https://www.naturalnews.com/wp-content/uploads/sites/91/2024/01/Transgender-Gender-Dysphoria-They-Them-Sign-Youth.jpg
366,America’s Long Campaign to Erase Gay People Is Itself Being Forgotten,And it’s being repeated.,"In the summer of 1984, after he finished his first U.S. Foreign Service assignment, in Yugoslavia, Jan Krc flew to Washington, D.C., for what he thought would be a couple of weeks’ training en route … [+35498 chars]",Jonathan Rauch,2024-01-26T12:00:00Z,,https://www.theatlantic.com/ideas/archive/2024/01/lavender-scare-gay-people-public-service-erasure/677236/?utm_source=feed,
367,Conservatives Offer to Pay Women to Boycott Transgender Golfer,"Amid backlash involving transgender golfer Hailey Davidson, Riley Gaines and others are calling for a boycott.","Amid backlash involving transgender golfer Hailey Davidson, conservatives, in an effort to boycott the transgender athlete, took to social media on Tuesday offering to pay women not to tee off with D… [+4620 chars]",Natalie Venegas,2024-01-24T19:23:56Z,newsweek,https://www.newsweek.com/calls-boycott-transgender-golfer-1863714,https://d.newsweek.com/en/full/2340189/riley-gaines.jpg
368,California judge blocks rule requiring police to disclose their gender identity,A California judge on Tuesday temporarily suspended a recently enacted rule mandating police officers to disclose their gender identity when they report traffic stops.,"A California judge on Tuesday temporarily suspended a recently enacted rule mandating police officers to disclose their gender identity when they report traffic stops. 
The decision stems from a law… [+2088 chars]",Christopher Wiggins,2024-01-24T20:21:23Z,,https://www.advocate.com/news/california-police-gender-identity-law,https://www.advocate.com/media-library/california-police-officer-george-floyd-protesters-los-angeles-city-hall-street-black-lives-matter-sign.jpg?id=51176501&width=1200&height=600&coordinates=0%2C0%2C0%2C78
369,How the Bud Light boycott became a meme bonanza,"Before partnering with transgender TikToker Dylan Mulvaney, Bud Light was just another light beer. 


But after running social media ads with Mulvaney in April 2023, right-wingers and anti-trans beer drinkers alike boycotted the brand in protest of its woke m…","Before partnering with transgender TikToker Dylan Mulvaney, Bud Light was just another light beer. 
But after running social media ads with Mulvaney in April 2023, right-wingers and anti-trans beer … [+4178 chars]",Tricia Crimmins,2024-01-26T14:00:00Z,,https://www.dailydot.com/debug/bud-light-memes-boycott/,https://uploads.dailydot.com/2024/01/BudLight-Memes.jpg?auto=compress&fm=pjpg
370,How the World of Competitive Climbing Was Rocked by Transphobia,"Frankie de la Cretaz



The governing body for sport climbing issued new restrictions on trans athletes with no warning. All hell broke loose.




The post How the World of Competitive Climbing Was Rocked by Transphobia appeared first on The Nation.","Society / February 2, 2024
The governing body for sport climbing issued new restrictions on trans athletes with no warning. All hell broke loose.
Ad Policy
Natalia Grossman of the United States ra… [+21641 chars]",Frankie de la Cretaz,2024-02-02T10:00:00Z,,https://www.thenation.com/?post_type=article&#038;p=483581,https://www.thenation.com/wp-content/uploads/2024/02/AP23298055951460.jpg
371,Transgender Woman Angry at Transphobia Arrested After Threatening Gun Photo,West said she spoke with a trans woman who had gender reassignment surgery and didn't have to pay anything out-of-pocket for it.,"A transgender woman in Oregon was recently arrested after posting photos showing several guns and speaking about being angry over transphobia.
FBI agents in Oregon arrested Elizabeth West last week … [+4725 chars]",Matthew Impelli,2024-01-16T16:47:16Z,newsweek,https://www.newsweek.com/transgender-woman-angry-transphobia-arrested-after-threatening-gun-photo-1861074,https://d.newsweek.com/en/full/2336425/transgender-woman-gun-posts-arrest.png
372,Transgender People in Florida Face Having Their Driver's Licenses Revoked,A memo from the Florida Department of Highway Safety and Motor Vehicles said transgender people can no longer change gender markers on their driver's licenses.,"Transgender people in Florida could have their driver's licenses revoked or face prosecution if they try to change their gender markers, according to a memo shared on social media.
Robert Kynoch, th… [+4668 chars]",Khaleda Rahman,2024-01-30T11:32:57Z,newsweek,https://www.newsweek.com/transgender-people-florida-face-drivers-licenses-revoked-1865187,https://d.newsweek.com/en/full/2342309/transgender-flag-held-above-crowd.jpg
373,Bethany Hamilton's Transgender Remark Sparks Boycott of Women's Event,The Women's Fund of the Oshkosh Area Community Foundation recently named Hamilton as a keynote speaker for an upcoming event.,"Pro-surfer Bethany Hamilton's past comments about transgender individuals in sports have sparked a boycott of an upcoming women's event in Wisconsin.
On Tuesday, WLUK-TV in Wisconsin obtained a lett… [+3336 chars]",Matthew Impelli,2024-01-17T17:17:31Z,newsweek,https://www.newsweek.com/bethany-hamilton-transgender-remarks-sparks-boycott-womens-event-1861557,https://d.newsweek.com/en/full/2337013/bethany-hamilton.jpg
374,Talented Artist Creates Funny Comic To Help Accept And Understand Transgender Experiences,The post Talented Artist Creates Funny Comic To Help Accept And Understand Transgender Experiences appeared first on Pleated Jeans.,"Sophie Labelle, a talented French-Canadian artist, is renowned for her impactful role as a transgender cartoonist, writer, activist, and public speaker. She gained widespread acclaim for her webcomic… [+1074 chars]",Mike,2024-01-13T16:30:14Z,,https://pleated-jeans.com/2024/01/13/artist-creates-funny-transgender-experiences-comic/,https://pleated-jeans.com/wp-content/uploads/2024/01/Untitled-1-2-copy-53.jpg
375,Largest survey of trans people ever says 40% experienced cyberbullying,"The U.S. Transgender Survey released its early insights yesterday, which included data stating that almost 40% of trans people have been harassed or bullied online because of their gender identity. What's more, 80% of adult respondents said they'd been harass…","The U.S. Transgender Survey released its early insights yesterday, which included data stating that almost 40% of trans people have been harassed or bullied online because of their gender identity. W… [+2120 chars]",Tricia Crimmins,2024-02-08T20:53:10Z,,https://www.dailydot.com/debug/trans-survey-cyberbullying/,https://uploads.dailydot.com/2024/02/Cyber-Bullying-Trans.jpg?auto=compress&fm=pjpg
376,Transgender golfer to face testosterone testing,Transgender golfer Hailey Davidson will be required to undergo testosterone testing to verify her eligibility and be the subject of a player poll after criticism of her winning a women's pro tour event.,Transgender golfer Hailey Davidson will be required to undergo testosterone testing to verify her eligibility and be the subject of a player poll after criticism of her winning a women's pro tour eve… [+2280 chars],"Rob Harris, Sports correspondent, and Tyrone Francis, Sports producer",2024-01-22T19:05:00Z,,https://news.sky.com/story/transgender-golfer-hailey-davidson-to-face-testosterone-testing-13054184,https://e3.365dm.com/24/01/1600x900/skynews-transgender-golfer_6429907.jpg?20240122193852
377,"ICE’s Use of Solitary Confinement ""Only Increasing"" Under Biden","A new report reveals that ICE continues to isolate immigrants en masse, including many with known mental health conditions.
The post ICE’s Use of Solitary Confinement “Only Increasing” Under Biden appeared first on The Intercept.",U.S. immigration authorities locked thousands of people in solitary confinement in 2023 as the United States continues to flout international human rights standards in its sprawling network of immigr… [+8108 chars],Spencer Woodman,2024-02-06T14:00:00Z,,http://theintercept.com/2024/02/06/ice-solitary-confinement-detention-immigration/,https://theintercept.com/wp-content/uploads/2024/02/GettyImages-1258485376.jpg?fit=5000%2C2500&w=1200&h=800
378,Rip Curl Faces Boycott Calls,The Australian brand's inclusion of transgender surfer Sasha Jane Lowerson on its Instagram page has sparked outrage.,"Australian brand Rip Curl is facing boycott calls after featuring transgender surfer Sasha Jane Lowerson on its Instagram page and apparently severing ties with pro surfer Bethany Hamilton.
Rip Curl… [+6390 chars]",Ryan Smith,2024-01-31T13:37:34Z,newsweek,https://www.newsweek.com/rip-curl-boycott-sasha-jane-lowerson-bethany-hamilton-transgender-instagram-1865599,https://d.newsweek.com/en/full/2342857/rip-curl-facing-boycott-calls.jpg
379,Supreme Court Dismisses Request To Take On Trans Student Bathroom Case,The Supreme Court on Tuesday declined to review a lower court&#039;s decision to allow a female student in the boys&#039; bathroom at an Indiana school district.,"The Supreme Court on Tuesday declined to review a lower court’s decision to allow a female student in the boys’ bathroom at an Indiana school district.
The Metropolitan School District of Martinsvil… [+2078 chars]",Kate Anderson,2024-01-16T19:04:12Z,,https://dailycaller.com/2024/01/16/supreme-court-dismisses-request-trans-student-bathroom-case/,https://cdn01.dailycaller.com/wp-content/uploads/2023/09/GettyImages-530594532-scaled-e1695760456417.jpg
380,Florida Democrat's Remark on Transgender Pregnancy Sparks Backlash,"On Wednesday, the Florida Supreme Court heard arguments over a proposed amendment that would increase abortion access.","Nikki Fried, the chairwoman of the Florida Democratic Party, received backlash on social media after diverting a question about transgender pregnancy.
On Wednesday, the Florida Supreme Court heard a… [+5579 chars]",Rachel Dobkin,2024-02-07T22:31:29Z,newsweek,https://www.newsweek.com/florida-democrats-remark-transgender-pregnancy-sparks-backlash-1867943,https://d.newsweek.com/en/full/2346134/abortion.jpg
381,Mord an Transgender-Jugendlicher: Lebenslange Haft für zwei 16-Jährige,Vor fast einem Jahr hatten in England ein Mädchen und ein Bursche die 16-jährige Brianna in einen Park gelockt und dort getötet. Sadismus und Transfeindlichkeit sollen bei der Tat eine Rolle gespielt haben.,Vor fast einem Jahr hatten in England ein Mädchen und ein Bursche die 16-jährige Brianna in einen Park gelockt und dort getötet. Sadismus und Transfeindlichkeit sollen bei der Tat eine Rolle gespielt… [+1573 chars],Die Presse,2024-02-02T16:27:39Z,,https://www.diepresse.com/18059995/mord-an-transgender-jugendlicher-lebenslange-haft-fuer-zwei-16-jaehrige,https://img.diepresse.com/public/incoming/dt8fnp-BRITAIN-CRIMETRANSGENDER/alternates/DPR_SOCIAL_NACHRICHTEN/BRITAIN-CRIMETRANSGENDER
382,"JUST IN: Ohio Legislature Bans Gender Affirming Care, Overriding Republican Governor’s Veto","Ohio's transgender children will be unable to obtain gender-affirming medical care, now that the Ohio Senate has voted to override Gov. Mike DeWine's veto.
The post JUST IN: Ohio Legislature Bans Gender Affirming Care, Overriding Republican Governor’s Veto fi…","Ohio’s transgender children will be unable to obtain gender-affirming medical care after all, now that the Ohio Senate has voted to override Gov. Mike DeWine’s (R-OH) veto on the issue by a vote of 2… [+1697 chars]",Jennifer Bowers Bahney,2024-01-24T21:04:52Z,,https://www.mediaite.com/politics/just-in-ohio-legislature-bans-gender-affirming-care-overriding-republican-governors-veto/,https://www.mediaite.com/wp-content/uploads/2023/03/Screen-Shot-2023-03-02-at-8.09.34-AM.jpg
383,âWokeâ journalism kills Sports Illustrated,Sports Illustrated (SI) laid off its entire staff and the iconic sports brand could be headed to the graveyard after years of woke journalism and a recent artificial intelligence scandal. (Article by Ed Kozak republished from TheNationalPulse.com) The details…,"Sports Illustrated (SI) laid off its entire staff and the iconic sports brand could be headed to the graveyard after years of woke journalism and a recent artificial intelligence scandal.
(Article b… [+1563 chars]",News Editors,2024-01-23T06:00:00Z,,https://www.naturalnews.com/2024-01-23-woke-journalism-kills-sports-illustrated.html,https://www.naturalnews.com/wp-content/uploads/sites/91/2024/01/Woke-Socially-Aware-Conscious-Name-Tag-1.jpeg
384,The Supreme Court declines to step into the fight over bathrooms for transgender students,"The Supreme Court on Tuesday passed up a chance to intervene in the debate over bathrooms for transgender students, rejecting an appeal from an Indiana public school district.","WASHINGTON (AP) The Supreme Court on Tuesday passed up a chance to intervene in the debate over bathrooms for transgender students, rejecting an appeal from an Indiana public school district.
Federa… [+1234 chars]",Associated Press,2024-01-16T15:17:27Z,,https://www.bostonherald.com/2024/01/16/the-supreme-court-declines-to-step-into-the-fight-over-bathrooms-for-transgender-students/,https://www.bostonherald.com/wp-content/uploads/2024/01/Supreme_Court_25164-4.jpg?w=1024&h=682
385,How the tide turned on transgender support charity Mermaids,Research shows how the group once portrayed as a respected source of advice because to be seen by some outlets as a danger to young people.,"BlurryMe/Shutterstock
The charity Mermaids, which offers support services to transgender young people and their caregivers in the UK, was once portrayed in the media as a respected source of advice … [+7143 chars]","Aimee Bailey, Lecturer in English Language, De Montfort University, Jai Mackenzie, Senior Lecturer in Applied Writing and Humanities, Newman University",2024-01-25T12:21:02Z,,https://theconversation.com/how-the-tide-turned-on-transgender-support-charity-mermaids-220613,https://images.theconversation.com/files/568172/original/file-20240108-20-cwznj1.jpg?ixlib=rb-1.1.0&rect=35%2C583%2C5955%2C2973&q=45&auto=format&w=1356&h=668&fit=crop
386,Transgender regret? Research challenges narratives about gender-affirming surgeries,The findings push back against the notion that many transgender people end up wishing they hadn’t gone through with gender-affirming surgeries.,"Gender-affirming surgeries give transgender people the opportunity to align their bodies with their gender identity. Luke Dray/Getty Images

 
 
 
 CC BY-SA
 

 

You’ll often hear lawmakers, activ… [+4619 chars]","Harry Barbee, Assistant Professor of Health, Behavior and Society, Johns Hopkins University, Bashar Hassan, Postdoctoral Research Fellow in Plastic and Reconstructive Surgery, Johns Hopkins University, Fan Liang, Assistant Professor of Plastic and Reconstructive Surgery, Johns Hopkins University",2024-01-22T13:30:00Z,,https://theconversation.com/transgender-regret-research-challenges-narratives-about-gender-affirming-surgeries-220642,https://images.theconversation.com/files/569390/original/file-20240115-19-obyz75.jpg?ixlib=rb-1.1.0&rect=0%2C0%2C4086%2C2043&q=45&auto=format&w=1356&h=668&fit=crop
387,2024 Olympics: Science Supports Excluding Male Athletes From Female Categories,"The countdown has begun—only six months until the 2024 Olympic Games. And already we can anticipate the serious challenges that female athletes will face in... Read More
The post 2024 Olympics: Science Supports Excluding Male Athletes From Female Categories a…","The countdown has begunonly six months until the 2024 Olympic Games. And already we can anticipate the serious challenges that female athletes will face in their quest for successmost critically, inc… [+5306 chars]",Daniela Constantino Llaven,2024-01-18T00:16:24Z,,https://www.dailysignal.com/2024/01/17/2024-olympics-science-supports-excluding-male-athletes-female-categories/,https://first-heritage-foundation.s3.amazonaws.com/live_files/2024/01/olympics.jpg
388,Fact Check: Can Black People Get Free Disney World Tickets During Black History Month?,A January 2024 rumor accurately reports that Black people can visit Disney World for free during Black History Month.,"On Jan. 15, 2024, Mouse Trap News published an article positing that Black guests would be able to visit Disney World free of charge during Black History Month (February). Posted on TikTok, the claim… [+2416 chars]",Taija PerryCook,2024-01-18T00:37:00Z,,https://www.snopes.com/fact-check/free-disney-black-history-month/,https://mediaproxy.snopes.com/width/1200/https://media.snopes.com/2024/01/free_tickets_for_black_history_month.jpg
389,Federal court overturns American transgender woman's persecution-based refugee claim,Canada's Federal Court has overturned a decision granting refugee status to an American transgender woman who successfully argued that a combination of gun culture and rising transphobia left her at risk of persecution in the United States.,Canada's Federal Court has overturned a decision granting refugee status to an American transgender woman who successfully argued that a combination of gun culture and rising transphobia left her at … [+5137 chars],,2024-02-03T02:25:48Z,cbc-news,https://www.cbc.ca/news/canada/british-columbia/refugee-transgender-united-states-persecution-1.7103455,https://i.cbc.ca/1.7103812.1706912928!/fileImage/httpImage/image.JPG_gen/derivatives/16x9_620/daria-bloodworth.JPG
390,Newcastle United Supporter Banned From Matches for Questioning Transgenderism Online: Report,Newcastle United has reportedly banned a fan from matches at its stadium over posts she made on social media criticising transgenderism.,"Newcastle United has reportedly banned a fan from attending matches at its stadium over posts she made on social media criticising transgender ideology, including asserting the biological reality tha… [+3561 chars]","Kurt Zindulka, Kurt Zindulka",2024-02-03T13:46:18Z,breitbart-news,https://www.breitbart.com/europe/2024/02/03/newcastle-united-fan-banned-from-matches-for-questioning-transgenderism-report/,https://media.breitbart.com/media/2024/02/GettyImages-1237012655-1-640x335.jpg
391,"Four-Year-Old Boy Admitted into Church of England School as a Girl, Flashed 'Their Willy' at Female Students",A Church of England school reportedly allowed a four-year-old boy to join as a girl while hiding his biological sex from other students,"A Church of England school reportedly allowed a four-year-old boy to join as a girl while hiding his biological sex from other students.
According to a report from The Telegraph, a Church of England… [+3476 chars]","Kurt Zindulka, Kurt Zindulka",2024-01-27T13:39:52Z,breitbart-news,https://www.breitbart.com/europe/2024/01/27/four-year-old-boy-admitted-into-church-of-england-school-as-a-girl/,https://media.breitbart.com/media/2024/01/GettyImages-1854003521-1-640x335.jpg
392,Harvard Prof. Pinker: Harvard Has Had Narrative Triumph over Pursuit of Fact,"During an interview aired on Wednesday’s broadcast of NPR’s “Here and Now,” Harvard Psychology Professor Steven Pinker stated that there has been an attack on free speech from the left within academia, including at Harvard, that is due to “a","During an interview aired on Wednesday’s broadcast of NPR’s “Here and Now,” Harvard Psychology Professor Steven Pinker stated that there has been an attack on free speech from the left within academi… [+3237 chars]","Ian Hanchett, Ian Hanchett",2024-01-25T09:06:06Z,breitbart-news,https://www.breitbart.com/clips/2024/01/25/harvard-prof-pinker-harvard-has-had-narrative-triumph-over-pursuit-of-fact/,https://media.breitbart.com/media/2024/01/GettyImages-1236437743-640x335.jpg
